{
  "schema_version": "1.1.0",
  "artifact_type": "evidence_index",
  "contract_id": "ctr-example",
  "run_id": "run-example",
  "claims": [
    {
      "claim_id": "claim-1",
      "question_id": "q1",
      "statement": "State one bounded conclusion.",
      "verdict": "inconclusive",
      "evidence_ids": ["ev-1"],
      "limitations": []
    }
  ],
  "evidence_items": [
    {
      "evidence_id": "ev-1",
      "kind": "table",
      "summary": "Describe the direct evidence.",
      "source": {
        "type": "artifact",
        "id": "artifact-1",
        "locator": "row or field locator"
      },
      "execution_id": "exec-1",
      "data_context": {
        "contrast_id": "contrast-1",
        "outcome_id": "primary-outcome",
        "analysis_set_id": "primary-analysis-set",
        "unit_type": "participant",
        "unit_set_artifact_id": "artifact-unit-membership"
      },
      "statistics": [
        {
          "name": "event_rate",
          "value": 0.25,
          "count_basis": "participants with an observed endpoint",
          "denominator": 100
        }
      ]
    }
  ],
  "extensions": {}
}
