{
  "schema_version": "1.0.0",
  "artifact_type": "evidence_index",
  "contract_id": "ctr-minimal",
  "run_id": "run-minimal",
  "claims": [
    {
      "claim_id": "claim-1",
      "question_id": "q1",
      "statement": "geneA is increased in the treated group in this fixture.",
      "verdict": "supported",
      "evidence_ids": ["ev-1"],
      "limitations": ["Synthetic fixture only."]
    }
  ],
  "evidence_items": [
    {
      "evidence_id": "ev-1",
      "kind": "statistic",
      "summary": "Positive prespecified effect with an adjusted p-value in range.",
      "source": {
        "type": "artifact",
        "id": "artifact-result",
        "locator": "row=geneA"
      },
      "execution_id": "exec-feature",
      "data_context": {
        "contrast_id": "treated-vs-control",
        "sample_set_id": "fixture-samples"
      },
      "statistics": [
        {
          "name": "log2_fold_change",
          "value": 1.2
        },
        {
          "name": "adjusted_p_value",
          "value": 0.02
        }
      ]
    }
  ],
  "extensions": {}
}
